{
    "slug": "ethcc5",
    "title": "ENS at EthCC5",
    "description": "I have attended EthCC every year since 2017 (when it was still called EDCON) and I am glad to be able to come back to Paris again with alisha.eth and lucemans.eth.",
    "date": "2022-06-27",
    "tags": [],
    "authors": ["matoken.eth"]
}
