{
  "slug": "breaking-down-ens",
  "title": "Breaking Down ENS (With Less Crypto Jargon)",
  "description": "ENS exists to simplify blockchain addresses and make crypto understandable and accessible to everyone.",
  "date": "2025-03-21",
  "tags": ["education", "subnames"],
  "authors": ["wesd.eth"]
}
