{
    "slug": "documentation-update-1",
    "cover": "https://img.youtube.com/vi/GwX_m28SSOA/0.jpg",
    "title": "Updating the ENS Documentation",
    "description": "The ENS Documentation is receiving an upgrade to its documentation featuring a new look and feel, improved navigation, and a full content rewrite.",
    "date": "2024-02-20",
    "youtube": "GwX_m28SSOA",
    "tags": ["youtube"],
    "authors": ["luc.eth"]
}
