{
    "slug": "ens-integrates-dot-box",
    "title": "ENS Labs Unveils Integration with .box Domains: A New Era for Web3 Identities",
    "description": "ENS Labs has partnered with Intercap to bring .box domains to the ENS Manager App",
    "date": "2024-04-23",
    "tags": [],
    "authors": ["my.box", "enslabs.eth"]
}
