{
    "slug": "multi-delegate-manager",
    "title": "ENS Labs Introduces the Multi-Delegate Manager to Increase Voting Participation in DAOs",
    "description": "With MDM, ENS token holders can easily delegate their voting power to multiple delegates without splitting up their tokens.",
    "date": "2025-03-28",
    "tags": [],
    "authors": ["enslabs.eth"]
}
