{
  "slug": "gemini-smart-wallet",
  "title": "Gemini Simplifies Smart Wallet Naming and Recovery with ENS",
  "description": "Geminiâ€™s new self-custodial smart wallet comes with built-in gemini.eth subnames, providing a unique name for every user.",
  "date": "2025-08-14",
  "tags": ["integrations"],
  "authors": ["enslabs.eth"]
}
