{
  "slug": "hacker-culture",
  "title": "Minding the Decentralized Gap: Why Hackers Shouldn't Dismiss the Crypto Movement",
  "description": "urbelis.eth explores the roots and shared values of the hacker and blockchain communities, and why now is the time to bridge the divide and build privacy-preserving technology together. How cypherpunk ideals and hacker culture are thriving in the Ethereum ecosystem.",
  "date": "2025-11-13",
  "tags": ["education", "events"],
  "authors": ["urbelis.eth"]
}
