{
  "slug": "arianee-partnership",
  "title": "Arianee Partners with ENS for Enhanced Digital Identity Management: A New Standard for Brands",
  "description": "Arianee has integrated ENS to enhance on-chain verified identity management for brands.",
  "date": "2024-09-26",
  "tags": [],
  "authors": ["wesd.eth"]
}
