{
    "slug": "town-hall-2022-Q4",
    "cover": "https://img.youtube.com/vi/BtvZGkKiMic/0.jpg",
    "title": "ENS Town Hall Q4 2022",
    "description": "Join us for an ENS Town Hall to review Q4 2022.",
    "date": "2022-12-15",
    "tags": ["youtube", "town_hall"],
    "authors": ["alisha.eth"],
    "youtube": "BtvZGkKiMic"
}
