{
  "slug": "ens-picks-linea",
  "title": "ENS Picks Linea for Layer 2 Rollout",
  "description": "ENS Labs has entered into a joint engineering partnership with the incredible team at Linea to build Namechain!",
  "date": "2024-12-17",
  "tags": ["ens-v2", "namechain"],
  "authors": ["enslabs.eth"]
}
