{
  "slug": "icann-84-gtld",
  "title": "How ENS Is Approaching ICANN's gTLD Expansion Program",
  "description": "Learn how ENS is thinking about protecting its own brand and namespace in the DNS ahead of the upcoming ICANN gTLD Expansion Program",
  "date": "2025-11-12T15:00:00.000Z",
  "tags": ["icann"],
  "authors": ["jamesbeck.eth"]
}
