{
    "slug": "frensday-2023",
    "title": "frENSday at DevConnect",
    "description": "ENS is excited to present frENSday, the premier event kicking off DevConnect 2023 in the vibrant city of Istanbul, TÃ¼rkiye.",
    "date": "2023-09-29",
    "tags": [],
    "authors": ["esk3nder.eth"],
    "draft": true
}
