{
    "slug": "joining-project-liberty",
    "title": "ENS Joins Project Liberty Alliance",
    "description": "Ethereum Name Service is one of the first crypto projects to join the Alliance in Support of The Peopleâ€™s Bid for TikTok.",
    "date": "2025-04-03",
    "tags": [],
    "authors": ["enslabs.eth"]
}
