{
    "slug": "null-byte-vulnerability",
    "title": "Null byte vulnerability in ENS subgraph Postmortem",
    "description": "In April 2022, we were informed of a vulnerability in our subgraph implementation by community contributor lcfr",
    "date": "2023-02-03",
    "tags": ["postmortem"],
    "authors": ["nick.eth"]
}
