{
  "slug": "celonames-powered-by-ens",
  "title": "Celonames, powered by ENS",
  "description": "Celonames, powered by ENS, are a new identity layer for people to send, receive, and build on Celo. They feature a unique privacy-preserving method for proving users are real people. ",
  "date": "2025-11-12T18:00:00.000Z",
  "tags": ["subnames", "identity"],
  "authors": ["enslabs.eth"]
}
