{
    "slug": "town-hall-2023-Q2",
    "cover": "https://img.youtube.com/vi/iKXtWaVn-tM/0.jpg",
    "title": "ENS Town Hall Q2 2023",
    "description": "Join us for the ENS Town Hall for Q2 2023! Streamed on Thursday, June 29, 2023.",
    "date": "2023-06-29",
    "tags": ["youtube", "town_hall"],
    "authors": ["alisha.eth"],
    "youtube": "iKXtWaVn-tM"
}
