{
  "slug": "private-transactions-with-fluidkey",
  "title": "Private ENS Transactions With Fluidkey",
  "description": "Fluidkey is a great option if you want to send or receive funds without leaking an accountâ€™s transaction history.",
  "date": "2025-03-25",
  "tags": ["privacy", "integrations"],
  "authors": ["jamesbeck.eth"]
}
