{
  "slug": "ens-app-explorer-introduction",
  "title": "ENS Evolves: Introducing Purpose-Built Tools for Every User",
  "description": "ENS evolves with two purpose-built tools for every user - introducing ENS App for seamless identity management and ENS Explorer for advanced visibility and control. ENSv2 represents our commitment to meeting every user where they are, whether they're taking their first steps into web3 identity or building the infrastructure that will onboard the next billion users.",
  "date": "2025-10-28",
  "tags": ["ens-v2", "design"],
  "authors": ["erni.eth"]
}
