{
  "slug": "locker-domains",
  "title": "Orange Domains brings .locker domains to Ethereum with ENS",
  "description": "DNS domain registry Orange Domains has claimed its gTLD .locker within the ENS protocol, giving its users direct access to the Ethereum ecosystem with their existing domains.",
  "date": "2025-09-04",
  "tags": ["dns"],
  "authors": ["enslabs.eth"]
}
